{
  "diagram_title": "組建系統提示區塊",
  "node_reference": "A22",
  "activities": [
    {
      "id": "A221",
      "title": "產出計費標頭區塊",
      "description": "系統區塊第零層：計費標頭文字，不設快取",
      "decomposition": null
    },
    {
      "id": "A222",
      "title": "產出身分宣告區塊",
      "description": "系統區塊第一層：官方身分識別字串，組織級快取",
      "decomposition": null
    },
    {
      "id": "A223",
      "title": "產出靜態指令區塊",
      "description": "系統區塊第二層：分界標記之前的程式指令、工具說明、語氣風格，全域快取",
      "decomposition": null
    },
    {
      "id": "A224",
      "title": "產出動態段落區塊",
      "description": "系統區塊第三層起：分界標記之後的記憶、環境資訊、對話引導，不設快取",
      "decomposition": null
    }
  ],
  "arrows": [
    {"id": "a22_i1", "source": "EXTERNAL", "target": "A221:input", "label": "第一則使用者訊息內容", "type": "input"},
    {"id": "a22_i2", "source": "EXTERNAL", "target": "A223:input", "label": "靜態指令段落", "type": "input"},
    {"id": "a22_i3", "source": "EXTERNAL", "target": "A224:input", "label": "動態段落（記憶、環境等）", "type": "input"},
    {"id": "a22_c1", "source": "EXTERNAL", "target": "A221:control", "label": "版本號與雜湊鹽值", "type": "control"},
    {"id": "a22_c2", "source": "EXTERNAL", "target": "A222:control", "label": "身分變體選擇規則", "type": "control"},
    {"id": "a22_c3", "source": "EXTERNAL", "target": "A223:control", "label": "分界標記位置", "type": "control"},
    {"id": "a22_c4", "source": "EXTERNAL", "target": "A223:control", "label": "快取範圍規則", "type": "control"},
    {"id": "a22_m1", "source": "EXTERNAL", "target": "A221:mechanism", "label": "歸屬雜湊演算器", "type": "mechanism"},
    {"id": "a22_f1", "source": "A221", "target": "A222:input", "label": "計費標頭文字區塊", "type": "input"},
    {"id": "a22_f2", "source": "A222", "target": "A223:input", "label": "計費＋身分區塊（前兩層）", "type": "input"},
    {"id": "a22_f3", "source": "A223", "target": "A224:input", "label": "靜態區塊陣列（含分界標記）", "type": "input"},
    {"id": "a22_o1", "source": "A224", "target": "EXTERNAL", "label": "完整系統提示區塊陣列", "type": "output"}
  ]
}
