{
  "diagram_title": "Provide MCP 工具 Surface",
  "node_reference": "A0",
  "activities": [
    {
      "id": "A1",
      "title": "Load App Manifest",
      "decomposition": {
        "diagram_title": "Load App Manifest",
        "node_reference": "A1",
        "activities": [
          {
            "id": "A11",
            "title": "Read Mcp Json 檔案"
          },
          {
            "id": "A12",
            "title": "Validate Against Manifest schema"
          },
          {
            "id": "A13",
            "title": "Infer Manifest 來自 來源 Tree"
          },
          {
            "id": "A14",
            "title": "合併 System 與 使用者 Tiers"
          }
        ],
        "arrows": [
          {
            "id": "a1in1",
            "source": "EXTERNAL",
            "target": "A11:input",
            "label": "App Directory 路徑"
          },
          {
            "id": "a1in2",
            "source": "EXTERNAL",
            "target": "A14:input",
            "label": "/etc/opencode/mcp-apps.js在 (system)"
          },
          {
            "id": "a1in3",
            "source": "EXTERNAL",
            "target": "A14:input",
            "label": "~/.config/opencode/mcp-apps.js在 (使用者)"
          },
          {
            "id": "a1c1",
            "source": "EXTERNAL",
            "target": "A12:control",
            "label": "Zod mcpappManifest.schema"
          },
          {
            "id": "a1c2",
            "source": "EXTERNAL",
            "target": "A14:control",
            "label": "System-Tier Wins 在 Id Collision"
          },
          {
            "id": "a1f1",
            "source": "A11:output",
            "target": "A12:input",
            "label": "Raw mcp.js在 位元組"
          },
          {
            "id": "a1f2",
            "source": "A11:output",
            "target": "A13:input",
            "label": "ENOENT Signal"
          },
          {
            "id": "a1f3",
            "source": "A13:output",
            "target": "A12:input",
            "label": "Generated Manifest Draft"
          },
          {
            "id": "a1f4",
            "source": "A12:output",
            "target": "A14:input",
            "label": "Validated mcpappManifest"
          },
          {
            "id": "a1err",
            "source": "A12:output",
            "target": "EXTERNAL",
            "label": "mcpManifest不found錯誤 (無 靜默 fallback)"
          },
          {
            "id": "a1out",
            "source": "A14:output",
            "target": "EXTERNAL",
            "label": "Merged App Catalog"
          }
        ]
      }
    },
    {
      "id": "A2",
      "title": "註冊 工具 Catalog",
      "decomposition": {
        "diagram_title": "註冊 工具 Catalog",
        "node_reference": "A2",
        "activities": [
          {
            "id": "A21",
            "title": "探測 Tools 透過 Throwaway Stdio"
          },
          {
            "id": "A22",
            "title": "Lint Bind Mount Policy"
          },
          {
            "id": "A23",
            "title": "建置 App Store 項目"
          },
          {
            "id": "A24",
            "title": "持久化 Managed App 狀態"
          }
        ],
        "arrows": [
          {
            "id": "a2in1",
            "source": "EXTERNAL",
            "target": "A21:input",
            "label": "已解析 Command 與 Env"
          },
          {
            "id": "a2c1",
            "source": "EXTERNAL",
            "target": "A22:control",
            "label": "Allowed Host Regex /執行/使用者/<uid>/opencode/sockets/*"
          },
          {
            "id": "a2c2",
            "source": "EXTERNAL",
            "target": "A23:control",
            "label": "McpAppStore.app項目 Shape (incl. 模型process)"
          },
          {
            "id": "a2c3",
            "source": "EXTERNAL",
            "target": "A24:control",
            "label": "BUILTIN CATALOG (currently empty)"
          },
          {
            "id": "a2f1",
            "source": "A21:output",
            "target": "A23:input",
            "label": "tools/清單 Snapshot"
          },
          {
            "id": "a2f2",
            "source": "A22:output",
            "target": "A23:input",
            "label": "Lint Verdict (pass | bindmountforbidden)"
          },
          {
            "id": "a2f3",
            "source": "A23:output",
            "target": "A24:input",
            "label": "Persisted 項目 記錄"
          },
          {
            "id": "a2out1",
            "source": "A24:output",
            "target": "EXTERNAL",
            "label": "managed-apps.js在 (FSM 狀態)"
          },
          {
            "id": "a2out2",
            "source": "A23:output",
            "target": "EXTERNAL",
            "label": "mcp-apps.js在 Tier 檔案 (透過 sudoWrapper 供 system)"
          }
        ]
      }
    },
    {
      "id": "A3",
      "title": "Connect Transport"
    },
    {
      "id": "A4",
      "title": "派發 工具 呼叫"
    },
    {
      "id": "A5",
      "title": "Synchronize Enablement 註冊表"
    },
    {
      "id": "A6",
      "title": "Unload 閒置 Apps (Proposed Seam)"
    }
  ],
  "arrows": [
    {
      "id": "m_in1",
      "source": "EXTERNAL",
      "target": "A1:input",
      "label": "App Directory + mcp-apps.js在"
    },
    {
      "id": "m_in2",
      "source": "EXTERNAL",
      "target": "A4:input",
      "label": "模型 工具 呼叫 (name + args)"
    },
    {
      "id": "m_in3",
      "source": "EXTERNAL",
      "target": "A3:input",
      "label": "OAuth Tokens (gauth.js在)"
    },
    {
      "id": "m_c1",
      "source": "EXTERNAL",
      "target": "A1:control",
      "label": "mcpappManifest.schema"
    },
    {
      "id": "m_c2",
      "source": "EXTERNAL",
      "target": "A2:control",
      "label": "Bind-Mount Policy + AGENTS.md 無-靜默-fallback"
    },
    {
      "id": "m_c3",
      "source": "EXTERNAL",
      "target": "A3:control",
      "label": "transport: stdio | streamable-http | sse"
    },
    {
      "id": "m_c4",
      "source": "EXTERNAL",
      "target": "A4:control",
      "label": "relaxtokenfields供dispatcher + IncomingDispatcher Rules"
    },
    {
      "id": "m_c5",
      "source": "EXTERNAL",
      "target": "A5:control",
      "label": "Enablement Sync Invariant (runtime == template)"
    },
    {
      "id": "m_c6",
      "source": "EXTERNAL",
      "target": "A6:control",
      "label": "tweaks.cfg mcp.閒置unloadms (proposed)"
    },
    {
      "id": "m_mech1",
      "source": "EXTERNAL",
      "target": "A3:control",
      "label": "Bun fetch unix:{socket路徑} + 解析unixsocketurl"
    },
    {
      "id": "m_mech2",
      "source": "EXTERNAL",
      "target": "A4:control",
      "label": "AI SDK dynamic工具 + experimentalrepair工具呼叫"
    },
    {
      "id": "m12",
      "source": "A1:output",
      "target": "A2:input",
      "label": "Validated Manifest + Tier-Merged Catalog"
    },
    {
      "id": "m23",
      "source": "A2:output",
      "target": "A3:input",
      "label": "App 項目 (command | url, transport)"
    },
    {
      "id": "m34",
      "source": "A3:output",
      "target": "A4:control",
      "label": "Connected MCPClient + tools()"
    },
    {
      "id": "m45",
      "source": "A4:output",
      "target": "A5:input",
      "label": "Active 工具 Names"
    },
    {
      "id": "m25",
      "source": "A2:output",
      "target": "A5:input",
      "label": "ManagedAppRegistry Capabilities"
    },
    {
      "id": "m5_out",
      "source": "A5:output",
      "target": "A4:control",
      "label": "enablement.js在 Snapshot 進入 LLM 提示"
    },
    {
      "id": "m_idle1",
      "source": "A4:output",
      "target": "A6:input",
      "label": "lastused於 Signal (proposed wiring)"
    },
    {
      "id": "m_idle2",
      "source": "A6:output",
      "target": "A3:control",
      "label": "Disconnect Trigger (proposed)"
    },
    {
      "id": "m_out1",
      "source": "A4:output",
      "target": "EXTERNAL",
      "label": "工具 結果 到 Runloop (session/llm.ts)"
    },
    {
      "id": "m_out2",
      "source": "A4:output",
      "target": "EXTERNAL",
      "label": "Direct 渲染 Side 通道 (.opencode/mcp-輸出)"
    },
    {
      "id": "m_out3",
      "source": "A6:output",
      "target": "EXTERNAL",
      "label": "mcp.app.unloaded Bus 事件 (proposed)"
    }
  ]
}
