{
  "diagram_title": "Gateway Google 登入 Binding 上下文",
  "node_reference": "A0",
  "activities": [
    {
      "id": "A1",
      "title": "Preserve Linux PAM Authority",
      "description": "Keep Linux PAM 作為 primary authority 供 依-使用者 daemon access.",
      "decomposition": null
    },
    {
      "id": "A2",
      "title": "驗證 Google 身分",
      "description": "Accept Google 登入 僅 through compatibility 路徑.",
      "decomposition": null
    },
    {
      "id": "A3",
      "title": "解析 Binding 註冊表",
      "description": "Look up Linux↔Google binding data 來自 全域 註冊表 under /etc/opencode/.",
      "decomposition": null
    },
    {
      "id": "A4",
      "title": "路由 或 Reject Session",
      "description": "路由 bound identities 到 matching 依-使用者 daemon 或 fail fast 供 unbound identities.",
      "decomposition": null
    }
  ],
  "arrows": [
    {
      "id": "AR1",
      "source": "EXTERNAL",
      "target": "A2:input",
      "label": "Google 登入 請求",
      "type": "input"
    },
    {
      "id": "AR2",
      "source": "EXTERNAL",
      "target": "A1:control",
      "label": "Linux PAM Policy",
      "type": "control"
    },
    {
      "id": "AR3",
      "source": "EXTERNAL",
      "target": "A3:control",
      "label": "Binding 註冊表 schema",
      "type": "control"
    },
    {
      "id": "AR4",
      "source": "A4:output",
      "target": "EXTERNAL",
      "label": "依-使用者 Daemon Session 或 Denial",
      "type": "output"
    },
    {
      "id": "AR5",
      "source": "EXTERNAL",
      "target": "A3:mechanism",
      "label": "/etc/opencode 註冊表 Module",
      "type": "mechanism"
    },
    {
      "id": "AR6",
      "source": "EXTERNAL",
      "target": "A1:mechanism",
      "label": "PAM Runtime",
      "type": "mechanism"
    },
    {
      "id": "AR7",
      "source": "A3:output",
      "target": "A4:input",
      "label": "已解析 Linux 使用者 Binding",
      "type": "output"
    }
  ]
}
