{
  "diagram_title": "Provider Hotfix — Functional Decomposition",
  "node_reference": "A0",
  "activities": [
    {
      "id": "A1",
      "title": "Revoke Codex OAuth Token 在 Logout",
      "description": "Before local 帳號 teardown, POST 刷新 token 到 upstream revoke endpoint; fail-closed 在 any 錯誤 so local 狀態 never detaches 來自 upstream",
      "decomposition": null
    },
    {
      "id": "A2",
      "title": "發出 Codex 上下文 Window Headers",
      "description": "Attach x-codex-window-id (依-Session UUID), x-codex-父層-thread-id (來自 Session.父層ID), 與 x-openai-子代理 (來自 agent lineage) 在 every Responses API 請求",
      "decomposition": null
    },
    {
      "id": "A3",
      "title": "Surface Anthropic xhigh Effort 供 Opus 4.7",
      "description": "Extend anthropic effort-variant transform 使用 xhigh budget 供 Opus 4.7+ 模型, gated 由 模型 id 或 releasedate",
      "decomposition": null
    },
    {
      "id": "A4",
      "title": "Narrow disabledProvider 到 Auto 僅",
      "description": "Keep Provider[id] populated when id 是 disabled; mark 作為 auto-hidden; let explicit get模型 解析; auto pickers filter 透過 flag",
      "decomposition": null
    },
    {
      "id": "A5",
      "title": "Bump Refs Pointers 與 記錄 Incident",
      "description": "Advance refs/claude-code + refs/codex submodule pointers 到 analysis HEADs 與 write docs/事件 項目 describing all phases",
      "decomposition": null
    }
  ],
  "arrows": [
    {
      "id": "AR1",
      "source": "EXTERNAL",
      "target": "A1:input",
      "label": "帳號 Remove 請求",
      "type": "input"
    },
    {
      "id": "AR2",
      "source": "EXTERNAL",
      "target": "A1:control",
      "label": "AGENTS.md Fail Closed Rule",
      "type": "control"
    },
    {
      "id": "AR3",
      "source": "A1:output",
      "target": "EXTERNAL",
      "label": "Revoked 帳號 或 錯誤",
      "type": "output"
    },
    {
      "id": "AR4",
      "source": "EXTERNAL",
      "target": "A1:mechanism",
      "label": "codex驗證 Revoke Helper",
      "type": "mechanism"
    },
    {
      "id": "AR5",
      "source": "EXTERNAL",
      "target": "A2:input",
      "label": "Outbound Responses 請求",
      "type": "input"
    },
    {
      "id": "AR6",
      "source": "EXTERNAL",
      "target": "A2:control",
      "label": "Upstream 2026-04 Baseline",
      "type": "control"
    },
    {
      "id": "AR7",
      "source": "A2:output",
      "target": "EXTERNAL",
      "label": "Headered 請求 到 Codex API",
      "type": "output"
    },
    {
      "id": "AR8",
      "source": "EXTERNAL",
      "target": "A2:mechanism",
      "label": "Openai 配額 Fetch Interceptor",
      "type": "mechanism"
    },
    {
      "id": "AR9",
      "source": "EXTERNAL",
      "target": "A3:input",
      "label": "Anthropic 模型 Metadata",
      "type": "input"
    },
    {
      "id": "AR10",
      "source": "EXTERNAL",
      "target": "A3:control",
      "label": "Opus 4.7 Launch Gate",
      "type": "control"
    },
    {
      "id": "AR11",
      "source": "A3:output",
      "target": "EXTERNAL",
      "label": "Variant Map 使用 xhigh",
      "type": "output"
    },
    {
      "id": "AR12",
      "source": "EXTERNAL",
      "target": "A3:mechanism",
      "label": "Transform Anthropic Branch",
      "type": "mechanism"
    },
    {
      "id": "AR13",
      "source": "EXTERNAL",
      "target": "A4:input",
      "label": "設定 disabledProvider 清單",
      "type": "input"
    },
    {
      "id": "AR14",
      "source": "EXTERNAL",
      "target": "A4:control",
      "label": "Auto vs Explicit Gate Policy",
      "type": "control"
    },
    {
      "id": "AR15",
      "source": "A4:output",
      "target": "EXTERNAL",
      "label": "Provider Universe 使用 Auto Hidden Flag",
      "type": "output"
    },
    {
      "id": "AR16",
      "source": "EXTERNAL",
      "target": "A4:mechanism",
      "label": "Provider Post Processing Loop",
      "type": "mechanism"
    },
    {
      "id": "AR17",
      "source": "EXTERNAL",
      "target": "A5:input",
      "label": "Analysis Baseline SHAs",
      "type": "input"
    },
    {
      "id": "AR18",
      "source": "EXTERNAL",
      "target": "A5:control",
      "label": "Release Checklist",
      "type": "control"
    },
    {
      "id": "AR19",
      "source": "A5:output",
      "target": "EXTERNAL",
      "label": "Super Repo Commit 與 事件 記錄",
      "type": "output"
    },
    {
      "id": "AR20",
      "source": "EXTERNAL",
      "target": "A5:mechanism",
      "label": "Git Submodule Bump",
      "type": "mechanism"
    }
  ]
}
