{
  "diagram_title": "Validate Optimization Effects",
  "node_reference": "A1",
  "activities": [
    {
      "id": "A11",
      "title": "Measure Telemetry Effects",
      "description": "Define the measurement spine that all optimization slices and sidebar evolution depend on.",
      "decomposition": "A11"
    },
    {
      "id": "A12",
      "title": "Govern Prompt Context",
      "description": "Define prompt-block classes, documentation-governance separation, and context-lifecycle policy.",
      "decomposition": null
    },
    {
      "id": "A13",
      "title": "Surface Context State",
      "description": "Define the accordion-based context inspector surfaces for active, compacted, and dormant context.",
      "decomposition": null
    }
  ],
  "arrows": [
    {
      "id": "AR1",
      "source": "EXTERNAL",
      "target": "A11:input",
      "label": "Optimization Planning Goal",
      "type": "input"
    },
    {
      "id": "AR2",
      "source": "EXTERNAL",
      "target": "A11:control",
      "label": "Builder Orientation Requirement",
      "type": "control"
    },
    {
      "id": "AR3",
      "source": "A11:output",
      "target": "A12:input",
      "label": "Measurement Backbone",
      "type": "output"
    },
    {
      "id": "AR4",
      "source": "EXTERNAL",
      "target": "A12:control",
      "label": "No Fallback Rule And Doc Governance Requirement",
      "type": "control"
    },
    {
      "id": "AR5",
      "source": "A11:output",
      "target": "A13:input",
      "label": "Telemetry UI Contract",
      "type": "output"
    },
    {
      "id": "AR6",
      "source": "A12:output",
      "target": "A13:control",
      "label": "Prompt Governance Taxonomy",
      "type": "control"
    },
    {
      "id": "AR7",
      "source": "A13:output",
      "target": "EXTERNAL",
      "label": "Builder Guidance Package",
      "type": "output"
    },
    {
      "id": "AR8",
      "source": "EXTERNAL",
      "target": "A11:mechanism",
      "label": "Validation Plan Diagram Skill",
      "type": "mechanism"
    },
    {
      "id": "AR9",
      "source": "EXTERNAL",
      "target": "A12:mechanism",
      "label": "Prompt Governance Concepts Planner Artifacts",
      "type": "mechanism"
    },
    {
      "id": "AR10",
      "source": "EXTERNAL",
      "target": "A13:mechanism",
      "label": "Sidebar Concepts Telemetry Concepts",
      "type": "mechanism"
    }
  ]
}
