{
  "diagram_title": "System 上下文",
  "node_reference": "A0",
  "activities": [
    {
      "id": "A1",
      "title": "Deliver Core Function",
      "description": "Top-優先序 function derived 來自 使用者 requirement",
      "decomposition": null
    }
  ],
  "arrows": [
    {
      "id": "AR1",
      "source": "EXTERNAL",
      "target": "A1:input",
      "label": "Primary 請求",
      "type": "input"
    },
    {
      "id": "AR2",
      "source": "EXTERNAL",
      "target": "A1:control",
      "label": "Policy 與 Constraints",
      "type": "control"
    },
    {
      "id": "AR3",
      "source": "A1:output",
      "target": "EXTERNAL",
      "label": "Deliverable",
      "type": "output"
    },
    {
      "id": "AR4",
      "source": "EXTERNAL",
      "target": "A1:mechanism",
      "label": "Execution Resources",
      "type": "mechanism"
    }
  ]
}
