{
  "diagram_title": "A33 組裝並發送 WS 請求",
  "node_reference": "A33",
  "activities": [
    {
      "id": "A331",
      "title": "檢查差量條件",
      "description": "若 previous_response_id 存在且 input.length > lastInputLength，裁切 input 只送新增項目。記錄完整長度至 state.lastInputLength。"
    },
    {
      "id": "A332",
      "title": "組裝 WS 訊框",
      "description": "移除 stream/background 欄位，包裹為 {type: 'response.create', ...wsBody}。保留 previous_response_id 作為差量識別。"
    },
    {
      "id": "A333",
      "title": "發送訊框並等待首幀",
      "description": "ws.send() 送出 JSON 訊框，設定狀態為 streaming，啟動閒置計時器。首幀探測（probeFirstFrame）等待第一個事件或逾時。"
    },
    {
      "id": "A334",
      "title": "建立事件串流",
      "description": "WS onmessage 事件 → JSON 解析 → 過濾 rate_limits → 錯誤事件偵測 → 正常事件推入 ReadableStream controller。response.completed 時關閉串流並更新接續狀態。"
    }
  ],
  "arrows": [
    {"id": "a331_in", "label": "完整 input 陣列 + previous_response_id", "source": "EXTERNAL", "target": "A331:input"},
    {"id": "a331_ctl", "label": "lastInputLength（上次輸入長度）", "source": "EXTERNAL", "target": "A331:control"},
    {"id": "a331_out", "label": "裁切後 input + deltaMode 旗標 + 更新後 lastInputLength", "source": "A331:output", "target": "A332:input"},

    {"id": "a332_ctl", "label": "response.create 包裝格式（移除 stream/background）", "source": "EXTERNAL", "target": "A332:control"},
    {"id": "a332_out", "label": "WS JSON 訊框字串", "source": "A332:output", "target": "A333:input"},

    {"id": "a333_in_ws", "label": "已開啟的 WebSocket 連線", "source": "EXTERNAL", "target": "A333:input"},
    {"id": "a333_ctl", "label": "WS_FIRST_FRAME_TIMEOUT_MS + WS_IDLE_TIMEOUT_MS", "source": "EXTERNAL", "target": "A333:control"},
    {"id": "a333_mech", "label": "ws.send() + probeFirstFrame()", "source": "EXTERNAL", "target": "A333:mechanism"},
    {"id": "a333_out_ok", "label": "首幀通過 → 進入串流模式", "source": "A333:output", "target": "A334:input"},
    {"id": "a333_out_fail", "label": "首幀逾時 → disableWebsockets + 回傳 null", "source": "A333:output", "target": "EXTERNAL"},

    {"id": "a334_ctl", "label": "錯誤解析規則（previous_response_not_found → CONTINUATION_INVALIDATED）", "source": "EXTERNAL", "target": "A334:control"},
    {"id": "a334_out", "label": "ReadableStream<ResponseStreamEvent>", "source": "A334:output", "target": "EXTERNAL"},
    {"id": "a334_out_state", "label": "response_id + lastInputLength → 接續狀態更新", "source": "A334:output", "target": "EXTERNAL"}
  ]
}
