{
  "diagram_title": "Telemetry 上下文 Sidebar Optimization — Functional Decomposition",
  "node_reference": "A0",
  "activities": [
    {
      "id": "A1",
      "title": "Define 上下文 Card Contract",
      "description": "Freeze three-card information architecture 與 ordering rules 供 上下文 sidebar.",
      "decomposition": null
    },
    {
      "id": "A2",
      "title": "渲染 上下文 Cards",
      "description": "Refactor Session上下文tab 到 present summary, breakdown, 與 提示 content 作為 cards aligned 使用 telemetry cards.",
      "decomposition": null
    },
    {
      "id": "A3",
      "title": "持久化 上下文 Card Order",
      "description": "Reuse 或 extend layout-狀態 persistence so card drag order survives sidebar reopening.",
      "decomposition": null
    },
    {
      "id": "A4",
      "title": "Validate Sidebar Experience",
      "description": "Verify rendering, ordering, 與 type-safety 供 optimized 上下文 sidebar.",
      "decomposition": null
    }
  ],
  "arrows": [
    {
      "id": "AR1",
      "source": "EXTERNAL",
      "target": "A1:input",
      "label": "使用者 Requirement 供 上下文 Sidebar Optimization",
      "type": "input"
    },
    {
      "id": "AR2",
      "source": "EXTERNAL",
      "target": "A1:control",
      "label": "規劃 Driver 與 專案 Constraints",
      "type": "control"
    },
    {
      "id": "AR3",
      "source": "A1:output",
      "target": "A2:control",
      "label": "Three Card Layout Contract",
      "type": "control"
    },
    {
      "id": "AR4",
      "source": "EXTERNAL",
      "target": "A2:input",
      "label": "Existing 上下文 Metrics 與 Telemetry Data",
      "type": "input"
    },
    {
      "id": "AR5",
      "source": "EXTERNAL",
      "target": "A2:mechanism",
      "label": "Session上下文tab 與 Telemetry Card Components",
      "type": "mechanism"
    },
    {
      "id": "AR6",
      "source": "A2:output",
      "target": "A3:input",
      "label": "Card Section Identifiers",
      "type": "input"
    },
    {
      "id": "AR7",
      "source": "EXTERNAL",
      "target": "A3:control",
      "label": "狀態 Sidebar Drag Pattern",
      "type": "control"
    },
    {
      "id": "AR8",
      "source": "EXTERNAL",
      "target": "A3:mechanism",
      "label": "Layout Store 與 Drag Drop Utilities",
      "type": "mechanism"
    },
    {
      "id": "AR9",
      "source": "A3:output",
      "target": "A4:input",
      "label": "Reorderable 上下文 Sidebar",
      "type": "input"
    },
    {
      "id": "AR10",
      "source": "EXTERNAL",
      "target": "A4:control",
      "label": "Validation Commands 與 Acceptance Checks",
      "type": "control"
    },
    {
      "id": "AR11",
      "source": "EXTERNAL",
      "target": "A4:mechanism",
      "label": "Typecheck 與 Targeted UI Tests",
      "type": "mechanism"
    },
    {
      "id": "AR12",
      "source": "A4:output",
      "target": "EXTERNAL",
      "label": "Execution 就緒 上下文 Sidebar 規劃",
      "type": "output"
    }
  ]
}
